<!--;;;;;;;;;;;;;;;;;;;;;;;;;;;;;;;;;;;;;;;;;;;;;;;;;;;;;;;;;;;;;;;;-->
<!--                                                                -->
<!-- Title:         Berlioz DTD for Web Access                      -->
<!-- System:        Berlioz                                         -->
<!-- Status:        Deprecated                                      -->
<!-- Description:   A schema for the defining the URL patterns and  -->
<!--                associated content generators.                  -->
<!-- Version:       1.0                                             -->
<!-- LastModified:  9 October 2009                                  -->
<!-- Author(s):     Christophe Lauret                               -->
<!--                                                                -->
<!--;;;;;;;;;;;;;;;;;;;;;;;;;;;;;;;;;;;;;;;;;;;;;;;;;;;;;;;;;;;;;;;;-->

<!--
  Top level element.
-->
<!ELEMENT web-access                                  ( generators* ) >

<!--
  A container for generators from the same area
-->
<!ELEMENT generators                                   ( generator* ) >
<!ATTLIST generators     area                     ID        #REQUIRED >

<!--
  A content generator.
-->
<!ELEMENT generator         ( path-info, redirect?, service, class? ) >
<!ATTLIST generator      id                       ID        #REQUIRED >

<!--
  The path info to follow
  
  The directory home attribute indicates that this page should be used
  as the default directory home.
-->
<!ELEMENT path-info                                       ( #PCDATA ) >
<!ATTLIST path-info      home          (true | false)        #IMPLIED >

<!--
  The redirect object associated to this content generator
-->
<!ELEMENT redirect                            (path-info, parameter*) >

<!--
  The parameter for any redirect
-->
<!ELEMENT parameter                                             EMPTY >
<!ATTLIST parameter      name                NMTOKEN        #REQUIRED >

<!--
  The content generator class
-->
<!ELEMENT class                                           ( #PCDATA ) >

<!--
  The content generator class
-->
<!ELEMENT service                                         ( #PCDATA ) >