<?xml version="1.0"?>
<!DOCTYPE web-access PUBLIC "-//Berlioz//DTD::Web Access 1.0//EN"
                            "../../../Core/resource/library/web-access-1.0.dtd">
<!--
    A test web access configuration file.

    @author  Christophe Lauret (Weborganic)
    @version 26 November 2009
-->
<web-access>

  <generators area="test">

    <generator id="P01">
      <path-info home="true">/home</path-info>
      <service>home</service>
    </generator>

    <generator id="P02">
      <path-info>/custom</path-info>
      <service>custom-service</service>
      <class>org.weborganic.berlioz.content.ContentManagerTest$Custom</class>
    </generator>

  </generators>

</web-access>